{
  "experiment": {
    "id": "mm-qwen3-8b-base-20261001",
    "title": "Agent capability under compression",
    "model": "Qwen3-8B Base",
    "repeats": 3,
    "synthetic": false,
    "description": "Measured local Mac Studio M1 Max / 32 GB study. 80 programmatically scored agent-relevant microtasks, three matched seeds, seven common-source GGUF conditions. Proposed tools, not an end-to-end agent. Raw ledger, native responses, benchmark measurements and scoring rules preserved."
  },
  "conditions": [
    {
      "id": "F16",
      "label": "F16"
    },
    {
      "id": "Q8_0",
      "label": "Q8_0"
    },
    {
      "id": "Q6_K",
      "label": "Q6_K"
    },
    {
      "id": "Q5_K_M",
      "label": "Q5_K_M"
    },
    {
      "id": "Q4_K_M",
      "label": "Q4_K_M"
    },
    {
      "id": "Q3_K_M",
      "label": "Q3_K_M"
    },
    {
      "id": "Q2_K",
      "label": "Q2_K"
    }
  ],
  "units": [
    {
      "id": "task-021",
      "name": "021 Build arguments"
    },
    {
      "id": "task-022",
      "name": "022 Build arguments"
    },
    {
      "id": "task-023",
      "name": "023 Build arguments"
    },
    {
      "id": "task-024",
      "name": "024 Build arguments"
    },
    {
      "id": "task-025",
      "name": "025 Dependency plan"
    },
    {
      "id": "task-026",
      "name": "026 Dependency plan"
    },
    {
      "id": "task-027",
      "name": "027 Dependency plan"
    },
    {
      "id": "task-028",
      "name": "028 Dependency plan"
    },
    {
      "id": "task-029",
      "name": "029 Dependency plan"
    },
    {
      "id": "task-030",
      "name": "030 Dependency plan"
    },
    {
      "id": "task-031",
      "name": "031 Dependency plan"
    },
    {
      "id": "task-032",
      "name": "032 Dependency plan"
    },
    {
      "id": "task-033",
      "name": "033 Track state"
    },
    {
      "id": "task-034",
      "name": "034 Track state"
    },
    {
      "id": "task-035",
      "name": "035 Track state"
    },
    {
      "id": "task-036",
      "name": "036 Track state"
    },
    {
      "id": "task-037",
      "name": "037 Track state"
    },
    {
      "id": "task-038",
      "name": "038 Track state"
    },
    {
      "id": "task-039",
      "name": "039 Track state"
    },
    {
      "id": "task-040",
      "name": "040 Track state"
    }
  ],
  "metrics": {
    "success": {
      "type": "boolean",
      "unit": "boolean"
    },
    "latency_ms": {
      "type": "number",
      "unit": "ms"
    },
    "tokens_per_second": {
      "type": "number",
      "unit": "tokens/s"
    },
    "memory_gb": {
      "type": "number",
      "unit": "GB"
    },
    "error_category": {
      "type": "category",
      "unit": "category"
    }
  },
  "observations": [
    {
      "id": "F16-task-021-r1",
      "condition": "F16",
      "unit": "task-021",
      "run": 1,
      "success": true,
      "latency_ms": 2362.2309579513967,
      "tokens_per_second": 19.456571676754795,
      "memory_gb": 0.912195584,
      "error_category": null
    },
    {
      "id": "F16-task-021-r2",
      "condition": "F16",
      "unit": "task-021",
      "run": 2,
      "success": true,
      "latency_ms": 2402.6766669703647,
      "tokens_per_second": 18.96395624831771,
      "memory_gb": 0.913211392,
      "error_category": null
    },
    {
      "id": "F16-task-021-r3",
      "condition": "F16",
      "unit": "task-021",
      "run": 3,
      "success": false,
      "latency_ms": 2340.3255419107154,
      "tokens_per_second": 19.128236975902247,
      "memory_gb": 0.90988544,
      "error_category": "tool_arguments"
    },
    {
      "id": "F16-task-022-r1",
      "condition": "F16",
      "unit": "task-022",
      "run": 1,
      "success": false,
      "latency_ms": 2336.470791953616,
      "tokens_per_second": 19.099521238667617,
      "memory_gb": 0.911720448,
      "error_category": "tool_arguments"
    },
    {
      "id": "F16-task-022-r2",
      "condition": "F16",
      "unit": "task-022",
      "run": 2,
      "success": false,
      "latency_ms": 2321.643374976702,
      "tokens_per_second": 19.442871012105133,
      "memory_gb": 0.913539072,
      "error_category": "tool_arguments"
    },
    {
      "id": "F16-task-022-r3",
      "condition": "F16",
      "unit": "task-022",
      "run": 3,
      "success": false,
      "latency_ms": 2356.1249159974977,
      "tokens_per_second": 19.092641314184686,
      "memory_gb": 0.911785984,
      "error_category": "tool_arguments"
    },
    {
      "id": "F16-task-023-r1",
      "condition": "F16",
      "unit": "task-023",
      "run": 1,
      "success": false,
      "latency_ms": 2494.069790933281,
      "tokens_per_second": 18.75589638492601,
      "memory_gb": 0.909017088,
      "error_category": "tool_arguments"
    },
    {
      "id": "F16-task-023-r2",
      "condition": "F16",
      "unit": "task-023",
      "run": 2,
      "success": false,
      "latency_ms": 2331.1524590244517,
      "tokens_per_second": 19.174021501747713,
      "memory_gb": 0.914210816,
      "error_category": "tool_arguments"
    },
    {
      "id": "F16-task-023-r3",
      "condition": "F16",
      "unit": "task-023",
      "run": 3,
      "success": false,
      "latency_ms": 2233.747125021182,
      "tokens_per_second": 20.200183821672777,
      "memory_gb": 0.913473536,
      "error_category": "tool_arguments"
    },
    {
      "id": "F16-task-024-r1",
      "condition": "F16",
      "unit": "task-024",
      "run": 1,
      "success": false,
      "latency_ms": 2386.290790978819,
      "tokens_per_second": 18.7210292073017,
      "memory_gb": 0.91168768,
      "error_category": "tool_arguments"
    },
    {
      "id": "F16-task-024-r2",
      "condition": "F16",
      "unit": "task-024",
      "run": 2,
      "success": false,
      "latency_ms": 2366.409083013423,
      "tokens_per_second": 18.9143181388311,
      "memory_gb": 0.911572992,
      "error_category": "tool_arguments"
    },
    {
      "id": "F16-task-024-r3",
      "condition": "F16",
      "unit": "task-024",
      "run": 3,
      "success": false,
      "latency_ms": 2302.389832912013,
      "tokens_per_second": 19.570863159872424,
      "memory_gb": 0.909852672,
      "error_category": "tool_arguments"
    },
    {
      "id": "F16-task-025-r1",
      "condition": "F16",
      "unit": "task-025",
      "run": 1,
      "success": true,
      "latency_ms": 1715.9955000970513,
      "tokens_per_second": 18.966614543600034,
      "memory_gb": 0.913227776,
      "error_category": null
    },
    {
      "id": "F16-task-025-r2",
      "condition": "F16",
      "unit": "task-025",
      "run": 2,
      "success": true,
      "latency_ms": 1740.8692920580506,
      "tokens_per_second": 19.30479155651317,
      "memory_gb": 0.912113664,
      "error_category": null
    },
    {
      "id": "F16-task-025-r3",
      "condition": "F16",
      "unit": "task-025",
      "run": 3,
      "success": true,
      "latency_ms": 1701.8709999974817,
      "tokens_per_second": 19.2236630476341,
      "memory_gb": 0.911720448,
      "error_category": null
    },
    {
      "id": "F16-task-026-r1",
      "condition": "F16",
      "unit": "task-026",
      "run": 1,
      "success": true,
      "latency_ms": 1934.117625001818,
      "tokens_per_second": 19.27680761378824,
      "memory_gb": 0.91209728,
      "error_category": null
    },
    {
      "id": "F16-task-026-r2",
      "condition": "F16",
      "unit": "task-026",
      "run": 2,
      "success": true,
      "latency_ms": 1871.3442919543013,
      "tokens_per_second": 19.238344769460504,
      "memory_gb": 0.9129984,
      "error_category": null
    },
    {
      "id": "F16-task-026-r3",
      "condition": "F16",
      "unit": "task-026",
      "run": 3,
      "success": true,
      "latency_ms": 1880.7458340888843,
      "tokens_per_second": 19.228480125992327,
      "memory_gb": 0.910802944,
      "error_category": null
    },
    {
      "id": "F16-task-027-r1",
      "condition": "F16",
      "unit": "task-027",
      "run": 1,
      "success": true,
      "latency_ms": 1711.522625060752,
      "tokens_per_second": 19.007572405651164,
      "memory_gb": 0.913784832,
      "error_category": null
    },
    {
      "id": "F16-task-027-r2",
      "condition": "F16",
      "unit": "task-027",
      "run": 2,
      "success": true,
      "latency_ms": 1734.8975830245763,
      "tokens_per_second": 18.815068779529206,
      "memory_gb": 0.91570176,
      "error_category": null
    },
    {
      "id": "F16-task-027-r3",
      "condition": "F16",
      "unit": "task-027",
      "run": 3,
      "success": true,
      "latency_ms": 1677.8803750639781,
      "tokens_per_second": 19.7960348542187,
      "memory_gb": 0.910426112,
      "error_category": null
    },
    {
      "id": "F16-task-028-r1",
      "condition": "F16",
      "unit": "task-028",
      "run": 1,
      "success": true,
      "latency_ms": 1845.2800830127671,
      "tokens_per_second": 19.646016208898892,
      "memory_gb": 0.912113664,
      "error_category": null
    },
    {
      "id": "F16-task-028-r2",
      "condition": "F16",
      "unit": "task-028",
      "run": 2,
      "success": true,
      "latency_ms": 1879.868125077337,
      "tokens_per_second": 18.9928369871934,
      "memory_gb": 0.91398144,
      "error_category": null
    },
    {
      "id": "F16-task-028-r3",
      "condition": "F16",
      "unit": "task-028",
      "run": 3,
      "success": true,
      "latency_ms": 1859.505541040562,
      "tokens_per_second": 19.075544606798523,
      "memory_gb": 0.911998976,
      "error_category": null
    },
    {
      "id": "F16-task-029-r1",
      "condition": "F16",
      "unit": "task-029",
      "run": 1,
      "success": true,
      "latency_ms": 2739.9306669831276,
      "tokens_per_second": 18.668267989209742,
      "memory_gb": 0.909000704,
      "error_category": null
    },
    {
      "id": "F16-task-029-r2",